{
  "registry_version": "1.2.0",
  "schema_version": "1.0",
  "authority": "Source & Data Acquisition Architecture",
  "seed_status": "authoritative_seeded",
  "sources": [
    {"source_id":"SRC-MOSPI-NAS","source_name":"National Accounts Statistics","institution":"Ministry of Statistics and Programme Implementation (MoSPI)","source_tier":1,"source_type":"statistical publication and official data portal","url_reference":"https://www.mospi.gov.in/publication/national-accounts-statistics-2025-26","dataset_relationship":["GDP","GVA","GSDP","National Accounts"],"retrieval_method":"official web publication/data portal","frequency":"annual and quarterly","publication_release_pattern":"annual National Accounts Statistics publication with quarterly GDP estimates and releases","archive_snapshot":null,"provenance":{"discovery_method":"official MoSPI website search","discovered_at":"2026-09-07","verification_status":"verified","verification_basis":"official MoSPI National Accounts Statistics page identifies NAS as the framework for GDP, GVA and GSDP"},"licensing_access":{"access":"public","redistribution":"source-specific terms to be checked before redistribution","access_notes":"official Government of India source"},"reliability_metadata":{"authority":"primary official Indian statistical source","reliability_status":"high","verification_date":"2026-09-07"},"status":"active"},
    {"source_id":"SRC-MOSPI-PLFS","source_name":"Periodic Labour Force Survey (PLFS)","institution":"Ministry of Statistics and Programme Implementation (MoSPI)","source_tier":1,"source_type":"official statistical survey and data portal","url_reference":"https://www.mospi.gov.in/themes/product/69--","dataset_relationship":["labour force participation","worker population ratio","unemployment","employment"],"retrieval_method":"official web data portal","frequency":"monthly, quarterly and annual","publication_release_pattern":"monthly bulletins, quarterly bulletins and annual survey outputs","archive_snapshot":null,"provenance":{"discovery_method":"official MoSPI PLFS product page","discovered_at":"2026-09-07","verification_status":"verified","verification_basis":"official MoSPI page identifies PLFS and its dashboard/database, with current monthly releases"},"licensing_access":{"access":"public","redistribution":"source-specific terms to be checked before redistribution","access_notes":"official Government of India source"},"reliability_metadata":{"authority":"primary official Indian statistical source","reliability_status":"high","verification_date":"2026-09-07"},"status":"active"},
    {"source_id":"SRC-MOSPI-CPI","source_name":"Consumer Price Index (CPI)","institution":"Ministry of Statistics and Programme Implementation (MoSPI)","source_tier":1,"source_type":"official price statistics data portal","url_reference":"https://mospi.gov.in/themes/product/9-consumer-price-index-cpi","dataset_relationship":["CPI","consumer inflation","food inflation"],"retrieval_method":"official web data portal","frequency":"monthly","publication_release_pattern":"monthly CPI release","archive_snapshot":null,"provenance":{"discovery_method":"official MoSPI CPI product page","discovered_at":"2026-09-07","verification_status":"verified","verification_basis":"official MoSPI CPI portal identifies CPI as the official consumer price measure and provides database/metadata"},"licensing_access":{"access":"public","redistribution":"source-specific terms to be checked before redistribution","access_notes":"official Government of India source"},"reliability_metadata":{"authority":"primary official Indian statistical source","reliability_status":"high","verification_date":"2026-09-07"},"status":"active"},
    {"source_id":"SRC-MOSPI-IIP","source_name":"Index of Industrial Production","institution":"Ministry of Statistics and Programme Implementation (MoSPI)","source_tier":1,"source_type":"official industrial statistics data portal","url_reference":"https://www.mospi.gov.in/themes/product/54-index-of-industrial-production","dataset_relationship":["IIP","industrial production","manufacturing production","mining production","electricity production"],"retrieval_method":"official web data portal","frequency":"monthly","publication_release_pattern":"monthly IIP release","archive_snapshot":null,"provenance":{"discovery_method":"official MoSPI IIP product page and metadata portal","discovered_at":"2026-09-07","verification_status":"verified","verification_basis":"official MoSPI portal identifies IIP as a monthly compiled and published indicator covering mining, manufacturing and electricity"},"licensing_access":{"access":"public","redistribution":"source-specific terms to be checked before redistribution","access_notes":"official Government of India source"},"reliability_metadata":{"authority":"primary official Indian industrial statistics source","reliability_status":"high","verification_date":"2026-09-07"},"status":"active"},
    {"source_id":"SRC-RBI-DBIE","source_name":"Database on Indian Economy","institution":"Reserve Bank of India","source_tier":1,"source_type":"official economic database","url_reference":"https://data.rbi.org.in/","dataset_relationship":["monetary statistics","banking","financial system","external sector","macroeconomic time series"],"retrieval_method":"official RBI database portal","frequency":"series-dependent","publication_release_pattern":"series-dependent releases and updates","archive_snapshot":null,"provenance":{"discovery_method":"official RBI DBIE portal reference","discovered_at":"2026-09-07","verification_status":"verified","verification_basis":"RBI's official privacy page identifies data.rbi.org.in as the Database on Indian Economy"},"licensing_access":{"access":"public portal","redistribution":"source-specific terms to be checked before redistribution","access_notes":"official Reserve Bank of India source"},"reliability_metadata":{"authority":"primary official Indian central bank source","reliability_status":"high","verification_date":"2026-09-07"},"status":"active"},
    {"source_id":"SRC-RBI-OBICUS","source_name":"Order Books, Inventories and Capacity Utilisation Survey (OBICUS)","institution":"Reserve Bank of India","source_tier":1,"source_type":"official manufacturing survey","url_reference":"https://www.rbi.org.in/Scripts/BS_PressReleaseDisplay.aspx?prid=48205","dataset_relationship":["manufacturing capacity utilisation","OBICUS","order books","inventories"],"retrieval_method":"official RBI survey releases and survey archive","frequency":"quarterly","publication_release_pattern":"quarterly survey results, subject to RBI publication schedule","archive_snapshot":null,"provenance":{"discovery_method":"official RBI OBICUS survey releases","discovered_at":"2026-09-07","verification_status":"verified","verification_basis":"RBI official releases identify OBICUS as the survey on manufacturing sector order books, inventories and capacity utilisation; RBI publications report manufacturing capacity utilisation from OBICUS"},"licensing_access":{"access":"public","redistribution":"source-specific terms to be checked before redistribution","access_notes":"official Reserve Bank of India source; survey results and historical releases require source-specific archival verification"},"reliability_metadata":{"authority":"primary official Indian central bank survey source","reliability_status":"high","verification_date":"2026-09-07"},"status":"active"},
    {"source_id":"SRC-MOF-UNION-BUDGET","source_name":"India Budget","institution":"Ministry of Finance, Government of India","source_tier":1,"source_type":"official budget portal","url_reference":"https://www.indiabudget.gov.in/","dataset_relationship":["Union Budget","Demands for Grants","public expenditure","fiscal documents","Economic Survey"],"retrieval_method":"official web portal and downloadable government documents","frequency":"annual","publication_release_pattern":"annual Union Budget and associated fiscal documents","archive_snapshot":null,"provenance":{"discovery_method":"official India Budget portal","discovered_at":"2026-09-07","verification_status":"verified","verification_basis":"official portal provides Union Budget, Demands for Grants, Economic Survey and prior budget archives"},"licensing_access":{"access":"public","redistribution":"source-specific terms to be checked before redistribution","access_notes":"official Government of India source"},"reliability_metadata":{"authority":"primary official Indian government source","reliability_status":"high","verification_date":"2026-09-07"},"status":"active"},
    {"source_id":"SRC-COMMERCE-TRADE","source_name":"Trade Statistics and Export Import Data Bank","institution":"Department of Commerce, Ministry of Commerce and Industry, Government of India","source_tier":1,"source_type":"official trade statistics portal","url_reference":"https://www.commerce.gov.in/ministryofcommerce/node/892","dataset_relationship":["merchandise exports","merchandise imports","trade by commodity","trade by country","trade by region"],"retrieval_method":"official web portal and linked Trade Intelligence and Analytics data bank","frequency":"monthly and annual","publication_release_pattern":"monthly updates with annual trade statistics","archive_snapshot":null,"provenance":{"discovery_method":"official Department of Commerce page","discovered_at":"2026-09-07","verification_status":"verified","verification_basis":"official page states that annual export/import data are available and the data bank is updated monthly from DGCI&S data"},"licensing_access":{"access":"public","redistribution":"source-specific terms to be checked before redistribution","access_notes":"official Government of India source"},"reliability_metadata":{"authority":"primary official Indian trade statistics source","reliability_status":"high","verification_date":"2026-09-07"},"status":"active"},